title,upvotes,subreddit,title_length,engagement_level
New Job Listings,5,marketing,16,Low
Please use the Report link to report posts and comments which don't belong in r/Marketing,30,marketing,89,Low
60 Second Marketing review for a junk removal company,8,marketing,53,Low
Still cramming all accounts into one setup? Run the smarter direction. Incogniton gives you unlimited profiles. Get 10 free to start.,4,marketing,133,Low
Marketing Plan Template for Health/Relationship App - Zero Budget Strategy,12,marketing,74,Low
"Jobs To Be Done or Value Proposition Canvas, for a retreat?",4,marketing,59,Low
How to know if you’re ready to transition to Marketing Operations from Email Marketing?,9,marketing,87,Low
Email people: how many email managers or specialists are at your job?,13,marketing,69,Low
Does upwork helpful in bringing more clients for advertising agency?,5,marketing,68,Low
I feel like I’m jumping between tasks every five minutes at my agency job. How do people manage this?,30,marketing,101,Low
AirBnB for OOH?,1,marketing,15,Low
New(ish) trend in marketing?,6,marketing,28,Low
Correct title for this marketing role?,2,marketing,38,Low
Games Marketing - Career Pivot Advice,6,marketing,37,Low
"How to sell ""advertising campaigns"" to big brands.",21,marketing,50,Low
Ad fatigue is KILLING your ROAS!,0,marketing,32,Low
What’s your take on social proof messaging on eCommerce stores?,15,marketing,63,Low
Which marketing channel gave you the best ROI in 2025 and what completely disappointed you?,27,marketing,91,Low
What helped you explain “why it’s worth it” without sounding defensive about price?,11,marketing,83,Low
Having a hard time showing testimonials. I see I can do case studies; but it almost feels like happy faces with star ratings is the way to go,3,marketing,141,Low
How do you use ChatGPT in your marketing activities?,5,marketing,52,Low
Anyone used tool migrations as intent signals?,8,marketing,46,Low
Importance of ORM for a Brand in Indian Market?,1,marketing,47,Low
Targeting nicotine users on Meta Ads Manager?,0,marketing,45,Low
What responsibilities or initiatives do you expect a strong marketing manager to have experience w/,2,marketing,99,Low
How to target audience without dropping the ball,5,marketing,48,Low
"If you have a SaaS, what is your Customer Acquisition Cost?",0,marketing,59,Low
